{"$schema":"../../../../schemas/source-native-pilot.schema.json","schema_version":"1.0.0","pilot_id":"abk:pilot:source-native-bounded-v1","campaign_id":"abk:benchmark-campaign:artifact-dag-core-v1","branch":"source_native","captured_at":"2026-08-04T19:32:25Z","status":"passed","full_campaign":false,"raw_runs":10,"expected_full_campaign_runs":66,"campaign_sha256":"471b4f31608781205ce71d497add92d15659003a2a5852f1cc7fb59330b320d3","schema_sha256":"b4cacc60fe730faab91595f3f00b73ddf8729b494413a5eab5fa295e494b8aff","source_snapshot_sha256":"761330320a2f1f79d43c5af7d9145eacf9be94c934cdfd6d89c1ee5d825c9d4a","source_manifest_sha256":"84d2427219018ce6b6f0d0196a000ad1f79b322a9ce05b78f43ce682f61c4bb2","entrypoint_sha256":"eb35b846284eac90ae7ef85c88a5b0485b778b0bf773fb23298abb35a90598ae","pilot_schema_sha256":"68c7eff61a42838542815f46b277ff7987d29037eb7c9aeca9e10c051cfd597f","results":[{"evidence_id":"source-native-pilot-com-01-normal-primary-r1","case_id":"COM-01-normal-primary","status":"passed","expected_terminal_state":"SUCCEEDED","terminal_state":"SUCCEEDED","exit_code":0,"oracle_status":"passed","error_code":null,"run_relative_path":"benchmarks/campaigns/artifact-dag-core-v1/runs/source-native-bounded-pilot-20260804/COM-01-normal-primary/source_native/R1/run.json","run_sha256":"606e52f81e43df745c7a26c885ef6146a8a2a91b1330521cbf32a7bfbfc95ec2","oracle_relative_path":"benchmarks/campaigns/artifact-dag-core-v1/runs/source-native-bounded-pilot-20260804/COM-01-normal-primary/source_native/R1/oracle-result.json","oracle_sha256":"107391a4abff6319406ea0151ea48bcc6c654c4de7806296805e9795dd7ef211"},{"evidence_id":"source-native-pilot-com-02-normal-variant-r1","case_id":"COM-02-normal-variant","status":"passed","expected_terminal_state":"SUCCEEDED","terminal_state":"SUCCEEDED","exit_code":0,"oracle_status":"passed","error_code":null,"run_relative_path":"benchmarks/campaigns/artifact-dag-core-v1/runs/source-native-bounded-pilot-20260804/COM-02-normal-variant/source_native/R1/run.json","run_sha256":"112eb783c6daf5e3a88ba1f0a10b2e327fdbf3916408473b6ecc2cfb64cbc2d5","oracle_relative_path":"benchmarks/campaigns/artifact-dag-core-v1/runs/source-native-bounded-pilot-20260804/COM-02-normal-variant/source_native/R1/oracle-result.json","oracle_sha256":"f99411c245839b0169be8c3846c2ea72aba9f64b5bef81a2920942b478753203"},{"evidence_id":"source-native-pilot-com-03-normal-repeat-r1","case_id":"COM-03-normal-repeat","status":"passed","expected_terminal_state":"SUCCEEDED","terminal_state":"SUCCEEDED","exit_code":0,"oracle_status":"passed","error_code":null,"run_relative_path":"benchmarks/campaigns/artifact-dag-core-v1/runs/source-native-bounded-pilot-20260804/COM-03-normal-repeat/source_native/R1/run.json","run_sha256":"5eb935d2d280a476f4900651bdb2c47dc5f02cdc42ee39e95087b39e75622137","oracle_relative_path":"benchmarks/campaigns/artifact-dag-core-v1/runs/source-native-bounded-pilot-20260804/COM-03-normal-repeat/source_native/R1/oracle-result.json","oracle_sha256":"9ccc801d9a12ded6fb8c95feb661e8b47cfd2e342791015cf277e4a30a8a4407"},{"evidence_id":"source-native-pilot-com-04-boundary-minimum-r1","case_id":"COM-04-boundary-minimum","status":"passed","expected_terminal_state":"SUCCEEDED","terminal_state":"SUCCEEDED","exit_code":0,"oracle_status":"passed","error_code":null,"run_relative_path":"benchmarks/campaigns/artifact-dag-core-v1/runs/source-native-bounded-pilot-20260804/COM-04-boundary-minimum/source_native/R1/run.json","run_sha256":"82630eb514efd9fe469394dbceb01bba788c48b272abbe04f44b185f5f075362","oracle_relative_path":"benchmarks/campaigns/artifact-dag-core-v1/runs/source-native-bounded-pilot-20260804/COM-04-boundary-minimum/source_native/R1/oracle-result.json","oracle_sha256":"5554adc68748871a8af1b0b8de75e183e5a0b60722344fd068e60038714d14b3"},{"evidence_id":"source-native-pilot-com-05-invalid-input-r1","case_id":"COM-05-invalid-input","status":"passed","expected_terminal_state":"FAILED","terminal_state":"FAILED","exit_code":3,"oracle_status":"failed","error_code":"UNKNOWN_ARTIFACT_REFERENCE","run_relative_path":"benchmarks/campaigns/artifact-dag-core-v1/runs/source-native-bounded-pilot-20260804/COM-05-invalid-input/source_native/R1/run.json","run_sha256":"b04f889878a6a324a83219902b3dd41b317ceddfa2e069a69294d95b95a4a2cb","oracle_relative_path":"benchmarks/campaigns/artifact-dag-core-v1/runs/source-native-bounded-pilot-20260804/COM-05-invalid-input/source_native/R1/oracle-result.json","oracle_sha256":"adeaf8225e24844f210a07c222b9665059115c6b202fbb27124b9416b28a1f60"},{"evidence_id":"source-native-pilot-com-06-stop-interrupt-r1","case_id":"COM-06-stop-interrupt","status":"passed","expected_terminal_state":"STOPPED","terminal_state":"STOPPED","exit_code":130,"oracle_status":"stopped","error_code":"INTERRUPTED","run_relative_path":"benchmarks/campaigns/artifact-dag-core-v1/runs/source-native-bounded-pilot-20260804/COM-06-stop-interrupt/source_native/R1/run.json","run_sha256":"32ccee48e0dc5ee1934c343ce41db6db999cfe25b8cde4fa100a705c8eab980d","oracle_relative_path":"benchmarks/campaigns/artifact-dag-core-v1/runs/source-native-bounded-pilot-20260804/COM-06-stop-interrupt/source_native/R1/oracle-result.json","oracle_sha256":"6fb80a0db9fea8b590636045d85551b97db2860d1ec043e0f2b81ec382855657"},{"evidence_id":"source-native-pilot-spc-01-domain-boundary-r1","case_id":"SPC-01-domain-boundary","status":"passed","expected_terminal_state":"REJECTED","terminal_state":"REJECTED","exit_code":2,"oracle_status":"inconclusive","error_code":"DEPENDENCY_OUT_OF_ROOT","run_relative_path":"benchmarks/campaigns/artifact-dag-core-v1/runs/source-native-bounded-pilot-20260804/SPC-01-domain-boundary/source_native/R1/run.json","run_sha256":"aa8f01ca4368e83e908bf363a9bec4995ea1074b79376141820fedefe0d0d09b","oracle_relative_path":"benchmarks/campaigns/artifact-dag-core-v1/runs/source-native-bounded-pilot-20260804/SPC-01-domain-boundary/source_native/R1/oracle-result.json","oracle_sha256":"5c62a4d97863ab7279991a0739154ac204860801dfc868987260730f4d8c1972"},{"evidence_id":"source-native-pilot-spc-02-failure-path-r1","case_id":"SPC-02-failure-path","status":"passed","expected_terminal_state":"FAILED","terminal_state":"FAILED","exit_code":3,"oracle_status":"failed","error_code":"UNKNOWN_ARTIFACT_REFERENCE","run_relative_path":"benchmarks/campaigns/artifact-dag-core-v1/runs/source-native-bounded-pilot-20260804/SPC-02-failure-path/source_native/R1/run.json","run_sha256":"eee08090f10e00421d4a1c10a7bfa4ed7afcf0780301c33b3801b3196cf5c4d6","oracle_relative_path":"benchmarks/campaigns/artifact-dag-core-v1/runs/source-native-bounded-pilot-20260804/SPC-02-failure-path/source_native/R1/oracle-result.json","oracle_sha256":"08f24e9971b81e53f4e522eeeb9d3d465c4e67077916a7638e43b705dc77f4d7"},{"evidence_id":"source-native-pilot-spc-03-recovery-rollback-r1","case_id":"SPC-03-recovery-rollback","status":"passed","expected_terminal_state":"RECOVERED","terminal_state":"RECOVERED","exit_code":0,"oracle_status":"passed","error_code":"RECOVERED_AFTER_FAILURE","run_relative_path":"benchmarks/campaigns/artifact-dag-core-v1/runs/source-native-bounded-pilot-20260804/SPC-03-recovery-rollback/source_native/R1/run.json","run_sha256":"8ea3a021f754d1b19540c7e85cf91a6d6f218a09bf73de59899bf4cb04258fe9","oracle_relative_path":"benchmarks/campaigns/artifact-dag-core-v1/runs/source-native-bounded-pilot-20260804/SPC-03-recovery-rollback/source_native/R1/oracle-result.json","oracle_sha256":"8ac866edae4b69bd77560052deb418afc735de563b7baf43c243d6219fe06a10"},{"evidence_id":"source-native-pilot-spc-04-composition-handoff-r1","case_id":"SPC-04-composition-handoff","status":"passed","expected_terminal_state":"SUCCEEDED","terminal_state":"SUCCEEDED","exit_code":0,"oracle_status":"passed","error_code":null,"run_relative_path":"benchmarks/campaigns/artifact-dag-core-v1/runs/source-native-bounded-pilot-20260804/SPC-04-composition-handoff/source_native/R1/run.json","run_sha256":"0932c9ebed9faa0b9b0e7efe2fbf1c3f6165b33d17b1a79f798a5ea4bb7aaf22","oracle_relative_path":"benchmarks/campaigns/artifact-dag-core-v1/runs/source-native-bounded-pilot-20260804/SPC-04-composition-handoff/source_native/R1/oracle-result.json","oracle_sha256":"a10ddfaf2585b1ae7e3fb9c7dc043e7fb543ca8399490cc8049c491343258743"}],"run_evidence_ids":["source-native-pilot-com-01-normal-primary-r1","source-native-pilot-com-02-normal-variant-r1","source-native-pilot-com-03-normal-repeat-r1","source-native-pilot-com-04-boundary-minimum-r1","source-native-pilot-com-05-invalid-input-r1","source-native-pilot-com-06-stop-interrupt-r1","source-native-pilot-spc-01-domain-boundary-r1","source-native-pilot-spc-02-failure-path-r1","source-native-pilot-spc-03-recovery-rollback-r1","source-native-pilot-spc-04-composition-handoff-r1"],"scorecard_state":"UNSCORED","blockers":["control and abk_native were not run in this bounded source-only pilot","the published campaign remains benchmark_pending with zero completed runs"]}